{
  "version": "2.0.0",
  "last_updated": "2026-09-02T17:50:09.681Z",
  "active_focus": {
    "phase_id": "Phase 11",
    "phase_name": "Phase 11: Workflow Evolution, Video Pipeline & Architecture Solidification",
    "objective": "スライドD&D並び替え、WebCodecs MP4自動トランジション動画エクスポート、Dexie複数プロジェクト管理、Syntax戦術JSON連携、およびストア・描画レイヤー・共通型定義の徹底リファクタリング。"
  },
  "tickets": [
    {
      "id": "AAWU-6-1",
      "title": "🔲 Default Auto-Fit Pitch Boundary Box",
      "phase": "Phase 6: Tactical Precision",
      "domain": "B: Tactical Board & Animation / Video",
      "assignee": "regista-canvas",
      "status": "DONE",
      "target_files": [
        "src/lib/types/tactical-unified.ts",
        "src/components/features/tactical-unified/canvas/boundary-box.tsx",
        "src/stores/tactical-unified-store.ts"
      ],
      "user_experience_impact": "新規スライド作成時やリセット時に、境界線ボックスが常にピッチ白線外周の均等余白に自動フィットするようになります。",
      "detailed_spec": [
        "tactical-unified.ts に定義されたデフォルト境界ボックス座標をピッチ実白線連動値（均等余白）に標準化",
        "boundary-box.tsx での初期レンダリング時のアスペクト比追従",
        "スライド作成時の初期化ロジックに自動フィットを適用"
      ],
      "acceptance_criteria": [
        "新規スライド追加時に境界線がピッチ白線に綺麗にフィットしていること",
        "type-check:scoped と biome check がパスすること"
      ],
      "verification_commands": {
        "biome": "rtk biome check src/components/features/tactical-unified/canvas/boundary-box.tsx",
        "type_check": "pnpm type-check:scoped src/components/features/tactical-unified/canvas/boundary-box.tsx",
        "vitest": "rtk vitest run src/components/features/tactical-unified/canvas/"
      },
      "execution_prompt": "Fast-Track Modeで AAWU-6-1: Default Auto-Fit Pitch Boundary Box を実装してください。新規スライド追加時の境界線ボックス初期値をピッチ白線均等余白に自動フィットさせます。",
      "completed_at": "2026-09-01T13:58:16.602Z",
      "completion_summary": [
        "ピッチ白線フィット境界線のデフォルト値 (16:9 / 9:16 / スクリーンショット) を tactical-unified.ts および boundary-box.tsx に配備済"
      ]
    },
    {
      "id": "AAWU-6-2",
      "title": "🏷️ Player Label High-Contrast Visibility Fix",
      "phase": "Phase 6: Tactical Precision",
      "domain": "B: Tactical Board & Animation / Video",
      "assignee": "regista-canvas",
      "status": "DONE",
      "target_files": [
        "src/components/features/tactical-unified/canvas/player-layer.tsx",
        "src/lib/tactical/export/tactical-frame-renderer.ts"
      ],
      "user_experience_impact": "暗いピッチ背景やスナップショット写真上でも、選手名と背番号ラベルがくっきり白文字＋アウトラインで視認できるようになります。",
      "detailed_spec": [
        "Konva Text の stroke 潰れを解消し、ダーク・グリーン・写真背景問わずクッキリ読める白文字アウトラインまたはバッジ背景を適用",
        "動画エクスポート用 renderer (tactical-frame-renderer.ts) との描画完全同期"
      ],
      "acceptance_criteria": [
        "ピッチ上および動画エクスポート後の選手名・背番号ラベルが高コントラストで視認できること",
        "type-check:scoped と biome check がパスすること"
      ],
      "verification_commands": {
        "biome": "rtk biome check src/components/features/tactical-unified/canvas/player-layer.tsx",
        "type_check": "pnpm type-check:scoped src/components/features/tactical-unified/canvas/player-layer.tsx",
        "vitest": "rtk vitest run src/lib/tactical/__tests__/"
      },
      "execution_prompt": "Fast-Track Modeで AAWU-6-2: Player Label High-Contrast Visibility Fix を実装してください。選手ラベルのストローク潰れを解消し高コントラスト化します。",
      "completed_at": "2026-09-01T13:58:20.899Z",
      "completion_summary": [
        "選手マーカー下ラベルおよび動画エクスポート用 renderer で #ffffff + stroke=#020617 (strokeWidth=2) による高コントラスト白文字描画を適用済"
      ]
    },
    {
      "id": "AAWU-6-4",
      "title": "👥 Sub-Centric Squad Panel & One-Click Pitch Deploy",
      "phase": "Phase 6: Tactical Precision",
      "domain": "A: Web App Core & UI",
      "assignee": "regista-frontend",
      "status": "DONE",
      "target_files": [
        "src/components/features/tactical-unified/right-panel/squad-sub-panel.tsx",
        "src/components/features/tactical-unified/canvas/unified-canvas.tsx"
      ],
      "user_experience_impact": "右パネルのSquadタブから、サブ選手をドラッグ＆ドロップせずともワンクリックでピッチ上の空きスペースへ投入できるようになります。",
      "detailed_spec": [
        "squad-sub-panel.tsx のサブ選手一覧の各行にワンクリックピッチ投入ボタンを配備",
        "投入時にピッチ上の適切な空きポジション（またはフォーメーション基準位置）へ自動配置しUndo履歴へ保存"
      ],
      "acceptance_criteria": [
        "サブ選手行の投入ボタンをクリックしてピッチ上にマーカーが出現すること",
        "type-check:scoped と biome check がパスすること"
      ],
      "verification_commands": {
        "biome": "rtk biome check src/components/features/tactical-unified/right-panel/squad-sub-panel.tsx",
        "type_check": "pnpm type-check:scoped src/components/features/tactical-unified/right-panel/squad-sub-panel.tsx",
        "vitest": "rtk vitest run src/components/features/tactical-unified/right-panel/"
      },
      "execution_prompt": "Fast-Track Modeで AAWU-6-4: Sub-Centric Squad Panel & One-Click Pitch Deploy を実装してください。サブ選手のワンクリックピッチ投入UIを配備します。",
      "completed_at": "2026-09-01T13:58:24.865Z",
      "completion_summary": [
        "SquadSubPanel にワンクリックピッチ投入ボタン ([+] 投入) を完備し、各ポジション別アコーディオンから即時投入可能に実装済"
      ]
    },
    {
      "id": "AAWU-9-1",
      "title": "🧩 Tactical Unified Store Slice Pattern Refactoring",
      "phase": "Phase 9: Tactical Board Polish & Presenter Architecture",
      "domain": "C: Data Layer, State & Contracts",
      "assignee": "regista-data",
      "status": "DONE",
      "target_files": [
        "src/stores/tactical-unified-store.ts",
        "src/stores/slices/slide-slice.ts",
        "src/stores/slices/history-slice.ts",
        "src/stores/slices/clipboard-slice.ts"
      ],
      "user_experience_impact": "ストアが機能別にモジュール化され、大量のスライドや複雑な戦術操作時でも高速な型推論と安定した状態同期が保証されます。",
      "detailed_spec": [
        "tactical-unified-store.ts の肥大化した状態管理を Zustand Slice Pattern（SlideSlice, HistorySlice, ClipboardSlice）に分離",
        "既存の公開インターフェースおよびUndo/Redoスタックの挙動を100%完全維持",
        "単体テストでの全回帰テスト完全パス"
      ],
      "acceptance_criteria": [
        "既存の全テスト（tactical-unified-store.test.ts等）が修正なしでパスすること",
        "type-check:scoped および biome check がエラー0件であること"
      ],
      "verification_commands": {
        "biome": "rtk biome check src/stores/",
        "type_check": "pnpm type-check:scoped src/stores/tactical-unified-store.ts",
        "vitest": "rtk vitest run src/stores/__tests__/"
      },
      "execution_prompt": "Fast-Track Modeで AAWU-9-1: Tactical Unified Store Slice Pattern Refactoring を実装してください。tactical-unified-store.ts を Slice Pattern に安全にリファクタリングします。",
      "completed_at": "2026-09-01T14:16:14.141Z",
      "completion_summary": [
        "Refactored to Slice Pattern",
        "Tests passed"
      ]
    },
    {
      "id": "AAWU-8-1",
      "title": "📸 Hardened DRM Capture Engine & Precise Video Crop",
      "phase": "Phase 8: Unified Extension & Tactical Capture Pipeline",
      "domain": "D: Browser Extension (Unified)",
      "assignee": "regista-extension",
      "status": "DONE",
      "target_files": [
        "extension/features/capture/drm-capture-engine.ts",
        "extension/features/capture/video-cropper.ts",
        "extension/features/capture/__tests__/video-cropper.test.ts"
      ],
      "user_experience_impact": "DRM保護された動画配信サイトでも黒画面にならず、上下左右の不要な黒帯を自動トリミングして試合ピッチ映像のみを瞬時にキャプチャできます。",
      "detailed_spec": [
        "多層Direct Composition回避CSS（filter, opacity, translate3d, scale等）によるDRM黒画面化防止",
        "動画生解像度とビューポート比率から余白レターボックスを自動計算しOffscreenCanvasで精密トリミング"
      ],
      "acceptance_criteria": [
        "単体テスト全件パス",
        "Scoped型チェックパス"
      ],
      "verification_commands": {
        "biome": "rtk biome check extension/features/capture/",
        "type_check": "pnpm type-check:scoped extension/features/capture/drm-capture-engine.ts",
        "vitest": "rtk vitest run extension/features/capture/__tests__/video-cropper.test.ts"
      },
      "execution_prompt": "AAWU-8-1の実装",
      "completed_at": "2026-09-01T20:00:00.000Z",
      "completion_summary": [
        "多層GPU合成DRM回避CSSトリックを整備しスクロールバーを完全隠蔽",
        "アスペクト比連動の黒帯自動トリミングエンジンを構築し単体テスト全5件パス"
      ]
    },
    {
      "id": "AAWU-8-2",
      "title": "🔌 Extension Integration & Global Shortcut Trigger",
      "phase": "Phase 8: Unified Extension & Tactical Capture Pipeline",
      "domain": "D: Browser Extension (Unified)",
      "assignee": "regista-extension",
      "status": "DONE",
      "target_files": [
        "extension/entrypoints/background.ts",
        "extension/entrypoints/overlay.content.tsx",
        "extension/types/messaging.ts",
        "extension/wxt.config.ts"
      ],
      "user_experience_impact": "ブラウザ上の動画視聴中に Alt+S を押すだけで、拡張機能単独で高精度キャプチャが即座に起動します。",
      "detailed_spec": [
        "extension/wxt.config.ts に capture-to-tactical (Alt+S) ショートカットを登録",
        "background.ts と overlay.content.tsx 間の型安全双方向メッセージング配備"
      ],
      "acceptance_criteria": [
        "WXT拡張機能ビルド成功",
        "型チェックパス"
      ],
      "verification_commands": {
        "biome": "rtk biome check extension/entrypoints/",
        "type_check": "pnpm type-check:scoped extension/entrypoints/background.ts"
      },
      "execution_prompt": "AAWU-8-2の実装",
      "completed_at": "2026-09-01T20:30:00.000Z",
      "completion_summary": [
        "Alt+S グローバルショートカットとメッセージングパイプラインを extension/ 単一パッケージに完全集約",
        "Chrome MV3 ビルドおよび Windows 側への sync-extension 完了"
      ]
    },
    {
      "id": "AAWU-8-3-A",
      "title": "🖼️ Snapshot Analysis Mode & Clean Canvas Initialization",
      "phase": "Phase 8: Unified Extension & Tactical Capture Pipeline",
      "domain": "A: Web App Core & UI",
      "assignee": "regista-frontend",
      "status": "DONE",
      "target_files": [
        "src/stores/tactical-unified-store.ts",
        "src/components/features/tactical-unified/hooks/use-tactical-capture-bridge.ts",
        "src/components/features/tactical-unified/right-panel/right-panel.tsx",
        "src/components/features/tactical-unified/toolbar/top-bar.tsx"
      ],
      "user_experience_impact": "拡張機能からキャプチャを受信した際、自動で白紙・画像モードに切り替わり、画面全体にキャプチャ画像がフィットして即座に戦術描画を開始できます。",
      "detailed_spec": [
        "キャプチャ受信時にピッチ線非表示、スタメン22人白紙化、ボール非表示",
        "境界ボックスを画像全域に自動フィットし、右パネルをPropertiesへ最適化"